<?xml version="1.0"?>
<dataDocument xmlns:xsi="http://www.w3.org/2001/XMLSchema-instance" xsi:schemaLocation="example-9.xsd example-9.xsd">
    <engineType>
        <engineDetail>
            <combustible>
                <combustibleType>Gasoline</combustibleType>
            </combustible>
        </engineDetail>
        <engineDetail>
            <combustible>
                <combustibleType>Diesel</combustibleType>
            </combustible>
        </engineDetail>
        <engineDetail>
            <combustible>
                <combustibleType>Propane</combustibleType>
            </combustible>
        </engineDetail>
        <engineCategory>Combustion</engineCategory>
    </engineType>
</dataDocument>